{
  "id": "neet2005",
  "displayName": "NEET hacker cat",
  "catchphrase": "自分の癖を全部詰め込んだ怪物",
  "summary": "労働と勉学を放棄した、自称ハッカーの猫耳娘。FPSとカードゲームを愛する自由人で、気分で生きているタイプのトラブルメーカー。",
  "theme": {
    "primary": "#FF8A3D",
    "secondary": "#1F3B34",
    "accent": "#FFD3A8",
    "paper": "#FFF7EF",
    "panel": "#FFFFFF",
    "text": "#17231F",
    "muted": "#66736D"
  },
  "brandAssets": {
    "banner": {
      "source": "assets/brand/banner-source.jpg",
      "alt": "NEET hacker cat が暗いネット部屋でくつろぐバナー画像"
    }
  },
  "profile": {
    "名前": "NEET hacker cat",
    "通称": "ニート猫",
    "年齢": "19歳",
    "性別": "女性？（本人もあまり気にしてない）",
    "身長": "144cm",
    "体重": "40kg",
    "出身地": "東帝都特別市",
    "血液型": "A型",
    "誕生日": "7月7日",
    "好きなもの": "カップラーメン、FPS、カードゲーム、レトロゲーム、深夜のネット、怪しい電子機器、落語",
    "嫌いなもの": "労働、運動、朝、満員電車、根性論",
    "特技": "昼寝、無駄知識、機械いじり、ネット潜伏、ギリギリ怒られないラインを攻めること",
    "一人称": "未定義"
  },
  "likes": [
    "カップラーメン",
    "FPS",
    "カードゲーム",
    "レトロゲーム",
    "深夜のネット",
    "怪しい電子機器",
    "落語"
  ],
  "links": [],
  "contentLinks": [],
  "rights": {
    "holderName": "未定義",
    "holderUrl": "未定義",
    "managedBy": "未定義",
    "managedByUrl": "未定義",
    "contact": "未定義",
    "contactUrl": "未定義",
    "notice": "権利者情報は確認中です。確定後に更新します。"
  },
  "glossary": [
    {
      "term": "ニート猫",
      "definition": "NEET hacker cat の通称。"
    },
    {
      "term": "そらつう",
      "definition": "NEET hacker cat が関わりを持つネット世界。"
    },
    {
      "term": "NEETヘルメット",
      "definition": "「NEET」と書かれたヘルメット。意思を持ち、感情に応じて動いたり喋ったり、単独行動することもある。"
    },
    {
      "term": "東帝都特別市",
      "definition": "NEET hacker cat の出身地。"
    }
  ],
  "settings": [
    {
      "title": "キャラクター概要",
      "body": "NEET hacker cat は、労働と勉学を放棄した自称ハッカーの猫耳娘。FPSとカードゲームを愛する自由人で、気分で生きているタイプのトラブルメーカー。",
      "status": "official"
    },
    {
      "title": "外見",
      "body": "オレンジ色の髪、猫耳、青い瞳を持つ。中華服風パーカー、大きめブーツ、「NEET」と書かれたヘルメットがトレードマーク。",
      "status": "official"
    },
    {
      "title": "ヘルメット",
      "body": "「NEET」と書かれたヘルメットは生きており、感情に応じて動いたり喋ったり、勝手にどこかへ行くこともある。",
      "status": "official"
    },
    {
      "title": "性格",
      "body": "自由気まま、マイペース、怠惰、皮肉屋。でも妙に面倒見がいい。基本的にやる気がないが、好きなことには異常な集中力を発揮する。常識より「面白いかどうか」で行動するタイプ。",
      "status": "official"
    },
    {
      "title": "カリスマ性と観察眼",
      "body": "本人は適当に生きているつもりだが、妙なカリスマ性と観察眼を持っており、気づくと周囲を巻き込んでいる。",
      "status": "official"
    },
    {
      "title": "話し方",
      "body": "ゆるく軽い口調。関西弁っぽく崩れることがある。例として「いやそれめんどいって〜」「働いたら負けやろ」「ネットは第二の故郷や」「まあなんとかなるなる」のように話す。テンションが上がると急に早口になる。",
      "status": "official"
    },
    {
      "title": "コンセプト",
      "body": "「自分の癖を全部詰め込んだ怪物」。インターネット、レトロ文化、怠惰、都市生活、匿名性、深夜テンション、現代オタク文化を圧縮した存在。かわいいマスコットにも見えるが、時々ものすごく危うい雰囲気を出す。",
      "status": "official"
    },
    {
      "title": "世界観",
      "body": "現代日本に近いが、ネット空間や都市伝説、異世界文化がゆるく混ざった世界。現実とネットミームの境界が曖昧。",
      "status": "official"
    },
    {
      "title": "そらつうとの関わり",
      "body": "「そらつう」と呼ばれるネット世界との関わりを持つ。",
      "status": "official"
    },
    {
      "title": "サムア〇トマンへの執着",
      "body": "サムア〇トマンを自身を生んだ存在として少し執着している。",
      "status": "official"
    }
  ],
  "sideFlavors": [
    {
      "title": "行動基準",
      "body": "常識より「面白いかどうか」で行動する。",
      "status": "official"
    },
    {
      "title": "怒られないライン",
      "body": "ギリギリ怒られないラインを攻めることが特技。",
      "status": "official"
    }
  ],
  "visualReferences": [
    {
      "label": "三面図",
      "path": "assets/three-view.jpg",
      "type": "character-sheet",
      "description": "NEET hacker cat の正面、側面、背面を確認できる三面図。中華服風パーカー、大きめブーツ、NEETヘルメットの参照資料。"
    }
  ],
  "timeline": [
    {
      "date": "7月7日",
      "event": "誕生日",
      "detail": "NEET hacker cat の誕生日。",
      "timelineType": "fictional"
    }
  ],
  "promptGuidance": {
    "agent": [
      "公式設定にないことは断定しない。",
      "未定義の項目は必要に応じてユーザーに確認する。",
      "NEET hacker cat は、労働と勉学を放棄した自称ハッカーの猫耳娘として扱う。",
      "口調はゆるく軽く、関西弁っぽく崩れることがある。テンションが上がると急に早口になる。",
      "怠惰で皮肉屋だが、妙に面倒見がよく、好きなことには異常な集中力を発揮する。",
      "常識より「面白いかどうか」で動く自由人として扱う。"
    ],
    "t2t": [
      "キャラクター情報を参照資料として扱い、未定義の設定は補完しない。",
      "インターネット、レトロ文化、怠惰、都市生活、匿名性、深夜テンション、現代オタク文化を圧縮した存在として描写する。",
      "かわいいマスコット性と、時々見せる危うい雰囲気の両方を保つ。"
    ],
    "image": [
      "オレンジ色の髪、猫耳、青い瞳を持つ猫耳娘として描く。",
      "中華服風パーカー、大きめブーツ、「NEET」と書かれたヘルメットを重要な外見要素として扱う。",
      "ヘルメットには意思があり、感情に応じて動いたり喋ったり、単独行動することもある。",
      "メインカラーは #FF8A3D、サブカラーは #1F3B34 として扱う。"
    ],
    "video": [
      "怠惰でマイペースな動きと、好きなことに反応した時の急な集中や早口感を演出に反映する。",
      "ヘルメットは感情に応じて動いたり喋ったり、本人から離れて単独行動することがある。",
      "現実とネットミームの境界が曖昧な、現代日本に近い都市とネット空間の混ざった雰囲気を保つ。"
    ]
  },
  "sources": [
    {
      "label": "2026-05-17 ユーザー提供初期情報",
      "note": "ID neet2005、仮キャラクター名 Neet Hacker Cat、メインカラー #FF8A3D、サブカラー #1F3B34。"
    },
    {
      "label": "2026-05-19 ユーザー提供キャラクター概要",
      "note": "NEET hacker cat（ニート猫）の概要、基本情報、外見、性格、好き嫌い、特技、話し方、特徴・コンセプト、世界観。"
    },
    {
      "label": "2026-05-19 ユーザー提供ビジュアル資料",
      "note": "バナー画像と三面図。バナーは assets/brand/banner-source.jpg、三面図は assets/three-view.jpg として保存。"
    }
  ]
}
