{
  "id": "demo-character",
  "displayName": "デモキャラクター",
  "catchphrase": "ここから公式設定を育てていく。",
  "summary": "このファイルは、キャラクター設定を蓄積するためのサンプルです。実際のキャラクター名や設定に置き換えて使います。",
  "profile": {
    "年齢": "未設定",
    "身長": "未設定",
    "体重": "未設定",
    "好きな食べ物": "未設定",
    "苦手なもの": "未設定",
    "一人称": "未設定"
  },
  "likes": [
    "未設定"
  ],
  "glossary": [
    {
      "term": "公式設定",
      "definition": "作者または運営が正本として扱う確定情報。"
    },
    {
      "term": "未確定設定",
      "definition": "候補として存在するが、まだ公式化していない情報。"
    }
  ],
  "settings": [
    {
      "title": "世界観",
      "body": "このキャラクターが存在する世界の基本ルールをここに記述します。",
      "status": "draft"
    },
    {
      "title": "話し方",
      "body": "口調、語尾、敬語の使い方、避ける表現などをここに記述します。",
      "status": "draft"
    }
  ],
  "timeline": [
    {
      "date": "未設定",
      "event": "誕生または初登場",
      "detail": "年表には、作中時系列と公開時系列のどちらかを明記すると運用しやすくなります。"
    }
  ],
  "promptGuidance": {
    "agent": [
      "公式設定にないことは断定しない。",
      "未設定の項目は、必要に応じてユーザーに確認する。",
      "キャラクターの口調は、profileとsettingsに記載された内容を優先する。"
    ],
    "image": [
      "外見設定が未確定の場合は、具体的な容姿を勝手に固定しない。",
      "キャラクターの象徴的な持ち物、服装、色が設定されたら優先して反映する。"
    ],
    "video": [
      "世界観に合わない演出を避ける。",
      "動作、表情、カメラワークはsettingsに記載された性格や雰囲気に合わせる。"
    ]
  },
  "sources": [
    {
      "label": "初期テンプレート",
      "note": "実際の出典に置き換えてください。"
    }
  ]
}
