{
  "id": "rhenimaru",
  "displayName": "真神 錸丸",
  "catchphrase": "未定義",
  "summary": "真神レニ丸は、炎を操る狼耳の剣士であり、圧倒的な機動力と嗅覚・聴覚を武器に戦場を駆け抜ける「迅錸の狂狼」。普段は強気で自信に満ちた少女だが、限界を超えると理性を失った狂狼状態へ移行し、味方すら判別できない獣のような戦闘本能で暴走する。",
  "theme": {
    "primary": "#ff5d00",
    "secondary": "#479355",
    "accent": "#fff3c4",
    "paper": "#fffaf0",
    "panel": "#ffffff",
    "text": "#1f1a12",
    "muted": "#756b5e"
  },
  "profile": {
    "呼称": "真神 錸丸",
    "読み": "まかみ れにまる",
    "動物": "ニホンオオカミ",
    "年齢": "20代前半",
    "身長": "160cm",
    "体重": "50kg",
    "好きな食べ物": "肉、寿司",
    "苦手なもの": "未定義",
    "一人称": "ボク",
    "愛称": "レニ(ちゃん)",
    "使用武器": "日本刀",
    "チャームポイント": "頭頂部のアホ毛",
    "異名": "迅錸の狂狼",
    "特徴": "炎を操る狼耳の剣士",
    "イメージカラー": "#ff5d00、#479355"
  },
  "likes": [
    "肉",
    "寿司"
  ],
  "links": [],
  "contentLinks": [],
  "glossary": [
    {
      "term": "迅錸の狂狼",
      "definition": "真神レニ丸の異名。炎を操る狼耳の剣士として、圧倒的な機動力と嗅覚・聴覚を武器に戦場を駆け抜ける存在を指す。"
    },
    {
      "term": "狂狼状態",
      "definition": "真神レニ丸が限界を超えた時に移行する状態。理性を失い、味方すら判別できない獣のような戦闘本能で暴走する。"
    }
  ],
  "settings": [
    {
      "title": "役割",
      "body": "炎を操る狼耳の剣士。",
      "status": "official"
    },
    {
      "title": "戦闘スタイル",
      "body": "圧倒的な機動力と嗅覚・聴覚を武器に、戦場を駆け抜ける。",
      "status": "official"
    },
    {
      "title": "使用武器",
      "body": "使用武器は日本刀。",
      "status": "official"
    },
    {
      "title": "外見・通常衣装",
      "body": "三面図では、オレンジ色の髪、狼耳、大きなオレンジ色の尻尾、左側の髪についた「Re」の髪飾り、白い上衣、緑のスカート、腰の緑の大きなリボン、背中で交差する濃緑の肩紐、茶色のブーツ、足首のファー飾り、日本刀を身につけた姿で描かれている。",
      "status": "official"
    },
    {
      "title": "動物モチーフ",
      "body": "動物はニホンオオカミ。",
      "status": "official"
    },
    {
      "title": "チャームポイント",
      "body": "チャームポイントは頭頂部のアホ毛。",
      "status": "official"
    },
    {
      "title": "衣装",
      "body": "白い上衣、緑のスカート、腰の緑の大きなリボン、背中で交差する濃緑の肩紐、茶色のブーツ、足首のファー飾り、日本刀を身につけた通常衣装。",
      "status": "official"
    },
    {
      "title": "異名",
      "body": "「迅錸の狂狼」と呼ばれる。",
      "status": "official"
    },
    {
      "title": "普段の性格",
      "body": "普段は強気で自信に満ちた少女。",
      "status": "official"
    },
    {
      "title": "狂狼状態",
      "body": "限界を超えると理性を失った狂狼状態へ移行し、味方すら判別できない獣のような戦闘本能で暴走する。",
      "status": "official"
    }
  ],
  "sideFlavors": [],
  "visualReferences": [
    {
      "label": "真神 錸丸 三面図",
      "path": "assets/rhenimaru-reference.png",
      "type": "outfit",
      "description": "正面・側面・背面を確認できる通常衣装の設定画像。"
    }
  ],
  "timeline": [],
  "promptGuidance": {
    "agent": [
      "公式設定にないことは断定しない。",
      "未定義の項目は必要に応じてユーザに確認する。",
      "キャラクター名を苗字・名前に分解しない。",
      "読みは「まかみ れにまる」として扱う。",
      "愛称は「レニ(ちゃん)」。",
      "年齢は20代前半、身長は160cm、体重は50kgとして扱う。",
      "一人称は「ボク」を使う。",
      "好きな食べ物は肉と寿司。",
      "動物はニホンオオカミとして扱う。",
      "真神レニ丸は、炎を操る狼耳の剣士として扱う。",
      "使用武器は日本刀として扱う。",
      "チャームポイントは頭頂部のアホ毛。",
      "普段は強気で自信に満ちた少女として扱う。",
      "狂狼状態では、理性を失い、味方すら判別できない獣のような戦闘本能で暴走する。"
    ],
    "t2t": [
      "キャラクター情報を参照資料として扱い、未定義の設定は補完しない。",
      "真神レニ丸を描写する場合は、炎を操る狼耳の剣士、圧倒的な機動力、嗅覚・聴覚を武器に戦うことを優先する。",
      "台詞では一人称「ボク」を使う。",
      "愛称として「レニ(ちゃん)」が使われる。",
      "好きな食べ物は肉と寿司。",
      "戦闘描写では日本刀を使用武器として扱う。",
      "普段の強気で自信に満ちた姿と、限界を超えた狂狼状態の落差を区別して描写する。"
    ],
    "image": [
      "外見設定が未定義の場合は、未定義として扱い、勝手に補完しない。",
      "通常衣装は三面図を優先する。",
      "ニホンオオカミを動物モチーフとして扱う。",
      "オレンジ色の髪、狼耳、大きなオレンジ色の尻尾を描く。",
      "頭頂部のアホ毛をチャームポイントとして描く。",
      "左側の髪に「Re」の髪飾りをつける。",
      "白い上衣、緑のスカート、腰の緑の大きなリボン、背中で交差する濃緑の肩紐、茶色のブーツ、足首のファー飾りを反映する。",
      "狼耳の剣士として描く。",
      "使用武器は日本刀として描く。",
      "炎を操る要素を反映する。",
      "イメージカラーは #ff5d00 と #479355 が提供されている。配色上の役割が未指定の場合は、#ff5d00 を primary、#479355 を secondary として扱う。"
    ],
    "video": [
      "動きや演出が未定義の場合は、未定義として扱い、勝手に補完しない。",
      "ニホンオオカミを動物モチーフとして扱う。",
      "日本刀を使う剣士として演出する。",
      "戦闘では圧倒的な機動力で戦場を駆け抜ける演出を優先する。",
      "嗅覚・聴覚を武器に状況を捉える描写を反映する。",
      "狂狼状態では、理性を失い、味方すら判別できない獣のような戦闘本能で暴走する。"
    ]
  },
  "sources": [
    {
      "label": "ユーザー依頼 2026-05-10",
      "note": "新規キャラクターIDとして rhenimaru が提供された。"
    },
    {
      "label": "ユーザー依頼 2026-05-10",
      "note": "カラーコードとして RGB(255,93,0) と RGB(71,147,85) が提供された。16進数では #ff5d00 と #479355。"
    },
    {
      "label": "ユーザー依頼 2026-05-10",
      "note": "表示名として「真神 錸丸」が提供された。漢字フォント対応が難しい場合の代替表記として「レニ丸」が提供された。"
    },
    {
      "label": "ユーザー依頼 2026-05-10",
      "note": "概要として、炎を操る狼耳の剣士、異名「迅錸の狂狼」、圧倒的な機動力と嗅覚・聴覚、普段の強気で自信に満ちた性格、限界を超えた時の狂狼状態が提供された。"
    },
    {
      "label": "ユーザー依頼 2026-05-10",
      "note": "名前の読み、年齢、身長、体重、一人称、使用武器が提供された。読みは「まかみ れにまる」、年齢は20代前半、身長は160cm、体重は50kg、一人称は「ボク」、使用武器は日本刀。"
    },
    {
      "label": "提供画像 FB9CCCC5-0954-4465-A8B9-33BE9963F086.png",
      "note": "真神 錸丸の正面・側面・背面を示す通常衣装の三面図として提供された。"
    },
    {
      "label": "ユーザー依頼 2026-05-10",
      "note": "動物はニホンオオカミ、チャームポイントは頭頂部のアホ毛、好きな食べ物は肉と寿司、愛称は「レニ(ちゃん)」として提供された。"
    }
  ]
}
