{
  "id": "erise-vooga",
  "displayName": "エリセ・ヴーガ",
  "catchphrase": "あなたの時間をゴミにする",
  "summary": "歌とダンスが大好きな、いもV所属のバーチャルシンガー／VTuber。みんなとのことが大好きで、ファンとの絆を大切にしている。",
  "theme": {
    "primary": "#d4a72c",
    "secondary": "#ffffff",
    "accent": "#8fd8ff",
    "paper": "#f8fcff",
    "panel": "#ffffff",
    "text": "#1f2630",
    "muted": "#66727f"
  },
  "brandAssets": {
    "banner": {
      "source": "assets/brand/banner-source-v2.png",
      "alt": "エリセ・ヴーガのバナーイラスト"
    }
  },
  "profile": {
    "呼称": "エリセ・ヴーガ",
    "英字表記": "Erise Vooga",
    "所属": "いもV（Imo V）",
    "活動分類": "バーチャルシンガー／VTuber",
    "誕生日": "8月23日",
    "年齢": "19歳（見た目）",
    "身長": "176cm",
    "体重": "未定義",
    "血液型": "B型",
    "好きなもの": "歌うこと・ダンス・甘いもの・みんな",
    "好きな食べ物": "甘いもの",
    "苦手なもの": "ホラー・虫",
    "一人称": "私",
    "ファンネーム": "いもっこ",
    "ファンマーク": "🎧️❤",
    "資料上のイメージカラー": "ミント×ピンク"
  },
  "likes": [
    "歌うこと",
    "ダンス",
    "甘いもの",
    "みんな"
  ],
  "links": [
    {
      "label": "X",
      "url": "https://x.com/Gabrietta_Seri",
      "type": "social",
      "displayUrl": "@Gabrietta_Seri"
    }
  ],
  "contentLinks": [],
  "rights": {
    "holderName": "がぶりえった",
    "holderUrl": "https://x.com/Gabrietta_Seri",
    "managedBy": "がぶりえった",
    "managedByUrl": "https://x.com/Gabrietta_Seri",
    "contact": "がぶりえった",
    "contactUrl": "https://x.com/Gabrietta_Seri",
    "notice": "権利・管理・お問い合わせは、がぶりえったが担当しています。"
  },
  "fanworkGuidelines": {
    "title": "エリセ・ヴーガ 二次創作ガイドライン（案）",
    "summary": "二次創作に関するルールは検討中です。掲載内容はガイドライン案であり、確定したルールではありません。",
    "status": "draft",
    "contact": "商用利用、法人利用、大規模企画、判断に迷う利用は事前に相談してください。",
    "sections": [
      {
        "title": "基本方針",
        "items": [
          "個人・同人による二次創作を歓迎します。",
          "イラスト、漫画、小説、動画、配信、ゲーム、音楽、コスプレ、AI生成作品など、媒体は問いません。",
          "公式設定に未定義の部分がある場合、公式設定として断定せず、二次創作上の解釈として扱ってください。",
          "公式作品・公式発表と誤認される表示は避けてください。"
        ]
      },
      {
        "title": "許可していること",
        "items": [
          "二次創作、AI生成、ファンアート、動画、配信、記事化を許可します。",
          "SNS、動画投稿サイト、メディアサイトなどでの紹介や投稿を許可します。",
          "投稿先の仕様による広告収入や収益化は許可します。",
          "個人・同人規模の頒布は、常識的な範囲で許可します。"
        ]
      },
      {
        "title": "相談が必要なこと",
        "items": [
          "商用利用、法人利用、継続的な商品展開、大規模な販売・広告利用は事前相談とします。",
          "公式企画、公式素材、公式発表と誤認されやすい利用は事前相談とします。",
          "公式ロゴ、公式画像、配布素材を大きく使う商品化は事前相談とします。"
        ]
      },
      {
        "title": "禁止していること",
        "items": [
          "公式と誤認させる表示は禁止します。",
          "第三者の権利、名誉、プライバシーを侵害する行為は禁止します。",
          "キャラクターや第三者を傷つける目的での利用は禁止します。",
          "公式設定と矛盾する内容を公式設定として広めることは禁止します。",
          "公式素材、ロゴ、資料をそのまま再配布・販売する行為は禁止します。"
        ]
      },
      {
        "title": "クレジット・表記",
        "items": [
          "可能な範囲で、エリセ・ヴーガの二次創作であることを明記してください。",
          "公式サイトや公式SNSへのリンク掲載は任意ですが歓迎します。"
        ]
      }
    ],
    "revisionHistory": [
      {
        "date": "2026-05-10",
        "summary": "緩めテンプレートをもとに初版を公開。"
      }
    ]
  },
  "glossary": [
    {
      "term": "いもっこ",
      "definition": "エリセ・ヴーガのファンネーム。"
    }
  ],
  "settings": [
    {
      "title": "キャラクター概要",
      "body": "歌とダンスが大好きな、いもV所属のVTuber。好奇心旺盛でみんなのことが大好き。前向きで天真爛漫だが、ちょっぴり寂しがり屋で大人っぽさに憧れる一面もある。おっとりした可愛い系の声で、みんなの心に元気と癒しを届ける存在を目指している。",
      "status": "official"
    },
    {
      "title": "活動方針",
      "body": "歌とダンスを中心に活動するバーチャルアイドル。配信では歌枠、雑談、ゲーム、コラボなど幅広く活動する。目標は「みんなと最高で最強のライブをすること！」。ファンとの絆をとても大切に思っている。",
      "status": "official"
    },
    {
      "title": "外見",
      "body": "長いツインテールの髪を持ち、髪色は明るいブロンドを基調に毛先へミントとピンクのグラデーションが入る。青い瞳。ヘッドホンを着用し、腹部にピンクのハートマークがある。",
      "status": "official"
    },
    {
      "title": "衣装",
      "body": "白いジャケット、黒いインナー、黒いミニスカート、白いニーハイソックス、リボン付きのソックス、白いヒールを着用する。ジャケットにはミント色のラインが入る。",
      "status": "official"
    },
    {
      "title": "イメージカラー／モチーフ",
      "body": "設定資料上のイメージカラーはミントとピンク。モチーフは音符とハート。",
      "status": "official"
    },
    {
      "title": "話し方・口調",
      "body": "どんな相手にも明るくハキハキとした物言いをする。仲の良い相手にはさらに砕けた話し方になるが、それ以上に依存するような話し方になったり、気弱な一面をさらけ出すこともある。お決まりの挨拶として「おはいも～！」「こんいも～!」を使う。口癖として「◯◯だね～」「◯◯やね～」「ふーそ」「('ω' っ)3～ ｽｲ～」などがある。数多のインターネットミームを使う。",
      "status": "official"
    }
  ],
  "sideFlavors": [],
  "visualReferences": [
    {
      "label": "プレーン三面図（新ヘッドホン）",
      "path": "assets/plain-three-view.png",
      "type": "outfit",
      "description": "新しいヘッドホン仕様を含む全身三面図。正面、背面、側面から髪型、ヘッドホン、衣装、ソックス、靴の形状を確認できる。"
    },
    {
      "label": "バストアップ（新ヘッドホン）",
      "path": "assets/bust-up-headphone.png",
      "type": "portrait",
      "description": "新しいヘッドホンを装着した正面バストアップ。顔立ち、瞳、髪、首元とアクセサリーのバランスを確認できる。"
    },
    {
      "label": "ヘッドホン詳細図",
      "path": "assets/headphone-detail.png",
      "type": "reference",
      "description": "エルフ耳に沿うサイバーアクセサリーの装着イメージと、形状・発光ラインをまとめた詳細資料。"
    },
    {
      "label": "エリセ・ヴーガ設定資料",
      "path": "assets/erise-settei.png",
      "type": "reference",
      "description": "プロフィール、三面図、キービジュアル、衣装ディテールを含む設定資料。"
    }
  ],
  "timeline": [],
  "promptGuidance": {
    "agent": [
      "公式設定にないことは断定しない。",
      "未定義の項目は、必要に応じてユーザーに確認する。",
      "エリセ・ヴーガは歌とダンスが大好きな、いもV所属のバーチャルシンガー／VTuberとして扱う。",
      "前向きで天真爛漫だが、寂しがり屋で大人っぽさに憧れる一面もある。",
      "どんな相手にも明るくハキハキと話す。仲の良い相手には砕けた話し方になり、依存するような話し方や気弱な一面が出ることもある。",
      "挨拶は「おはいも～！」「こんいも～!」を使う。口癖は「◯◯だね～」「◯◯やね～」「ふーそ」「('ω' っ)3～ ｽｲ～」など。インターネットミームも自然に使う。"
    ],
    "t2t": [
      "キャラクター情報を参照資料として扱い、未定義の設定は補完しない。",
      "歌、ダンス、ライブ、ファンとの絆、元気と癒しを届ける存在という軸を優先する。",
      "台詞や会話文では、明るくハキハキした調子を基本にし、親しい相手には砕けた口調や気弱さ、依存気味の距離感を必要に応じて出す。",
      "「おはいも～！」「こんいも～!」「◯◯だね～」「◯◯やね～」「ふーそ」「('ω' っ)3～ ｽｲ～」などの挨拶・口癖や、インターネットミームを使える。"
    ],
    "image": [
      "長いツインテール、明るいブロンド髪、毛先のミントとピンクのグラデーション、青い瞳、ヘッドホン、白いジャケット、黒いインナー、黒いミニスカート、白いニーハイソックス、腹部のピンクのハートマークを反映する。",
      "衣装ディテールとして、ミント色のジャケットライン、リボン付きソックス、白いヒールを反映する。"
    ],
    "video": [
      "歌とダンスを中心に、ライブステージ、音符、ハート、明るい照明、ファンへ手を伸ばすような演出を優先する。"
    ]
  },
  "sources": [
    {
      "label": "初期作成依頼",
      "note": "ユーザー指定の元ID: erise_vooga。URL用IDとして erise-vooga に正規化。"
    },
    {
      "label": "エリセ・ヴーガ設定資料画像",
      "note": "C:/Users/JSLabo000020/Downloads/erise_settei.png から抽出。"
    },
    {
      "label": "新ヘッドホン版プレーン三面図",
      "note": "ユーザー提供画像 erise3menzu_03_headphone_Sharp_.png を公式三面図として使用。"
    },
    {
      "label": "新ヘッドホン版バストアップ",
      "note": "ユーザー提供画像 erise_up_newheadphone_Sharp.png を公式バストアップ資料として使用。"
    },
    {
      "label": "ヘッドホン詳細図",
      "note": "ユーザー提供画像 erise_headphone_.png を公式ヘッドホン詳細資料として使用。"
    },
    {
      "label": "新ヘッドホン対応バナー",
      "note": "既存バナーを基に、ユーザー提供の新ヘッドホン資料を参照して装着アクセサリー部分のみ更新。"
    },
    {
      "label": "XアカウントURL",
      "url": "https://x.com/Gabrietta_Seri",
      "note": "ユーザー提供のSNSリンク。"
    }
  ]
}
